{
  "$schema": "./schemas/repo-map.schema.json",
  "version": 1,
  "generated_at": "2026-08-05",
  "toolchain": {
    "node": "22.x",
    "pnpm": "pnpm@9.15.1",
    "typescript": "^6.0.3",
    "turbo": "^2.10.4"
  },
  "workspaces": [
    {
      "name": "@sergeant/landing",
      "path": "apps/landing",
      "category": "app",
      "private": true,
      "version": "0.1.0",
      "type": "module",
      "frameworkDeps": [
        {
          "name": "playwright",
          "version": "^1.61.1"
        },
        {
          "name": "react",
          "version": "^18.3.0"
        },
        {
          "name": "react-dom",
          "version": "^18.3.0"
        },
        {
          "name": "tailwindcss",
          "version": "^4.3.2"
        },
        {
          "name": "typescript",
          "version": "^6.0.3"
        },
        {
          "name": "vite",
          "version": "^7.0.0"
        },
        {
          "name": "vitest",
          "version": "^3.2.4"
        }
      ],
      "testRunner": "vitest",
      "owner": null
    },
    {
      "name": "@sergeant/mobile",
      "path": "apps/mobile",
      "category": "app",
      "private": true,
      "version": "0.1.0",
      "frameworkDeps": [
        {
          "name": "@tanstack/react-query",
          "version": "^5.101.2"
        },
        {
          "name": "better-auth",
          "version": "^1.6.23"
        },
        {
          "name": "expo",
          "version": "~52.0.0"
        },
        {
          "name": "jest",
          "version": "^29"
        },
        {
          "name": "nativewind",
          "version": "^4.2.5"
        },
        {
          "name": "react",
          "version": "18.3.1"
        },
        {
          "name": "react-dom",
          "version": "18.3.1"
        },
        {
          "name": "react-native",
          "version": "0.76.9"
        },
        {
          "name": "tailwindcss",
          "version": "^4.3.2"
        },
        {
          "name": "typescript",
          "version": "~6.0.3"
        }
      ],
      "testRunner": "jest",
      "owner": null
    },
    {
      "name": "@sergeant/mobile-shell",
      "path": "apps/mobile-shell",
      "category": "app",
      "private": true,
      "version": "0.1.0",
      "type": "module",
      "frameworkDeps": [
        {
          "name": "@capacitor/cli",
          "version": "^7.6.7"
        },
        {
          "name": "@capacitor/core",
          "version": "^7.6.7"
        },
        {
          "name": "typescript",
          "version": "^6.0.3"
        },
        {
          "name": "vitest",
          "version": "^4.1.10"
        }
      ],
      "testRunner": "vitest",
      "owner": null
    },
    {
      "name": "@sergeant/server",
      "path": "apps/server",
      "category": "app",
      "private": true,
      "version": "0.1.0",
      "type": "module",
      "frameworkDeps": [
        {
          "name": "@sentry/node",
          "version": "^8.55.1"
        },
        {
          "name": "better-auth",
          "version": "^1.6.23"
        },
        {
          "name": "drizzle-orm",
          "version": "^0.45.2"
        },
        {
          "name": "express",
          "version": "^5.2.1"
        },
        {
          "name": "pg",
          "version": "^8.22.0"
        },
        {
          "name": "pino",
          "version": "^10.3.1"
        },
        {
          "name": "prom-client",
          "version": "^15.1.3"
        },
        {
          "name": "tsx",
          "version": "^4.23.0"
        },
        {
          "name": "typescript",
          "version": "^6.0.3"
        },
        {
          "name": "vitest",
          "version": "^4.1.10"
        },
        {
          "name": "zod",
          "version": "^4.3.6"
        }
      ],
      "testRunner": "vitest",
      "owner": null
    },
    {
      "name": "@sergeant/web",
      "path": "apps/web",
      "category": "app",
      "private": true,
      "version": "0.1.0",
      "type": "module",
      "frameworkDeps": [
        {
          "name": "@playwright/test",
          "version": "^1.61.1"
        },
        {
          "name": "@sentry/react",
          "version": "^8.55.1"
        },
        {
          "name": "@tanstack/react-query",
          "version": "^5.101.2"
        },
        {
          "name": "better-auth",
          "version": "^1.6.23"
        },
        {
          "name": "drizzle-orm",
          "version": "^0.45.2"
        },
        {
          "name": "msw",
          "version": "^2.15.0"
        },
        {
          "name": "react",
          "version": "^18.3.0"
        },
        {
          "name": "react-dom",
          "version": "^18.3.0"
        },
        {
          "name": "tailwindcss",
          "version": "^4.3.2"
        },
        {
          "name": "typescript",
          "version": "^6.0.3"
        },
        {
          "name": "vite",
          "version": "^8.1.4"
        },
        {
          "name": "vitest",
          "version": "^4.1.10"
        },
        {
          "name": "zod",
          "version": "^4.3.6"
        }
      ],
      "testRunner": "vitest",
      "owner": null
    },
    {
      "name": "@sergeant/api-client",
      "path": "packages/api-client",
      "category": "package",
      "private": true,
      "version": "0.1.0",
      "type": "module",
      "frameworkDeps": [
        {
          "name": "@tanstack/react-query",
          "version": "^5.0.0"
        },
        {
          "name": "react",
          "version": "^18.0.0 || ^19.0.0"
        },
        {
          "name": "typescript",
          "version": "^6.0.3"
        },
        {
          "name": "vitest",
          "version": "^4.1.10"
        }
      ],
      "testRunner": "vitest",
      "owner": null
    },
    {
      "name": "@sergeant/config",
      "path": "packages/config",
      "category": "package",
      "private": true,
      "version": "0.1.0",
      "type": "module",
      "frameworkDeps": [],
      "testRunner": null,
      "owner": null
    },
    {
      "name": "@sergeant/db-schema",
      "path": "packages/db-schema",
      "category": "package",
      "private": true,
      "version": "0.1.0",
      "type": "module",
      "frameworkDeps": [
        {
          "name": "drizzle-orm",
          "version": "^0.45.2"
        },
        {
          "name": "pg",
          "version": "^8.22.0"
        },
        {
          "name": "typescript",
          "version": "^6.0.3"
        },
        {
          "name": "vitest",
          "version": "^4.1.10"
        }
      ],
      "testRunner": "vitest",
      "owner": null
    },
    {
      "name": "@sergeant/design-tokens",
      "path": "packages/design-tokens",
      "category": "package",
      "private": true,
      "version": "0.1.0",
      "type": "module",
      "frameworkDeps": [
        {
          "name": "vitest",
          "version": "^4.1.10"
        }
      ],
      "testRunner": "vitest",
      "owner": null
    },
    {
      "name": "@sergeant/dualwrite-core",
      "path": "packages/dualwrite-core",
      "category": "package",
      "private": true,
      "version": "0.1.0",
      "type": "module",
      "frameworkDeps": [
        {
          "name": "typescript",
          "version": "^6.0.3"
        },
        {
          "name": "vitest",
          "version": "^4.1.10"
        }
      ],
      "testRunner": "vitest",
      "owner": null
    },
    {
      "name": "@sergeant/finyk-domain",
      "path": "packages/finyk-domain",
      "category": "package",
      "private": true,
      "version": "0.1.0",
      "type": "module",
      "frameworkDeps": [
        {
          "name": "typescript",
          "version": "^6.0.3"
        },
        {
          "name": "vitest",
          "version": "^4.1.10"
        }
      ],
      "testRunner": "vitest",
      "owner": null
    },
    {
      "name": "@sergeant/fizruk-domain",
      "path": "packages/fizruk-domain",
      "category": "package",
      "private": true,
      "version": "0.1.0",
      "type": "module",
      "frameworkDeps": [
        {
          "name": "typescript",
          "version": "^6.0.3"
        },
        {
          "name": "vitest",
          "version": "^4.1.10"
        }
      ],
      "testRunner": "vitest",
      "owner": null
    },
    {
      "name": "@sergeant/insights",
      "path": "packages/insights",
      "category": "package",
      "private": true,
      "version": "0.1.0",
      "type": "module",
      "frameworkDeps": [
        {
          "name": "typescript",
          "version": "^6.0.3"
        },
        {
          "name": "vitest",
          "version": "^4.1.10"
        }
      ],
      "testRunner": "vitest",
      "owner": null
    },
    {
      "name": "@sergeant/nutrition-domain",
      "path": "packages/nutrition-domain",
      "category": "package",
      "private": true,
      "version": "0.1.0",
      "type": "module",
      "frameworkDeps": [
        {
          "name": "typescript",
          "version": "^6.0.3"
        },
        {
          "name": "vitest",
          "version": "^4.1.10"
        }
      ],
      "testRunner": "vitest",
      "owner": null
    },
    {
      "name": "@sergeant/routine-domain",
      "path": "packages/routine-domain",
      "category": "package",
      "private": true,
      "version": "0.1.0",
      "type": "module",
      "frameworkDeps": [
        {
          "name": "typescript",
          "version": "^6.0.3"
        },
        {
          "name": "vitest",
          "version": "^4.1.10"
        }
      ],
      "testRunner": "vitest",
      "owner": null
    },
    {
      "name": "@sergeant/shared",
      "path": "packages/shared",
      "category": "package",
      "private": true,
      "version": "0.1.0",
      "type": "module",
      "frameworkDeps": [
        {
          "name": "typescript",
          "version": "^6.0.3"
        },
        {